<?xml version="1.0" encoding="UTF-8" ?>
<module xmlns:xsi="http://www.w3.org/2001/XMLSchema-instance" xsi:noNamespaceSchemaLocation="../schema/model.xsd">

  <name>mymodule</name>
  <version>1.0.0</version>
  <display-name>My Test Module</display-name>

  <vendor>
    <name>Enonic</name>
    <url>http://www.enonic.com</url>
  </vendor>

  <content>
    <meta-step mixin="system:menu-item"/>
    <meta-step mixin="mymodule:my-meta-mixin"/>
  </content>

  <config>
    <mixin-reference name="test">
      <reference>mymodule-1.0.0:other</reference>
    </mixin-reference>
  </config>

</module>
